Function ID,Function Name,Description,Batch,Status,Test Status,Implementation File,Route Endpoint
131,"CRM Script Generator","Generates CRM follow-up scripts from client notes",14,IMPLEMENTED,VALIDATED,server/automationBatch14.ts,/api/automation-batch-14/function-131
132,"Intake Form Validator","Validates client intake form data completeness",14,IMPLEMENTED,VALIDATED,server/automationBatch14.ts,/api/automation-batch-14/function-132
133,"Silent Call Detector","Detects calls with no transcript or voice activity",14,IMPLEMENTED,VALIDATED,server/automationBatch14.ts,/api/automation-batch-14/function-133
134,"QA Failure Alert","Sends alerts when QA tests fail",14,IMPLEMENTED,VALIDATED,server/automationBatch14.ts,/api/automation-batch-14/function-134
135,"ISO Date Formatter","Formats dates to ISO standard format",14,IMPLEMENTED,VALIDATED,server/automationBatch14.ts,/api/automation-batch-14/function-135
136,"Personality Assigner","Assigns AI personality based on industry type",14,IMPLEMENTED,VALIDATED,server/automationBatch14.ts,/api/automation-batch-14/function-136
137,"SmartSpend Entry Creator","Creates budget tracking entries in SmartSpend",14,IMPLEMENTED,VALIDATED,server/automationBatch14.ts,/api/automation-batch-14/function-137
138,"Voice Session ID Generator","Generates unique session IDs for voice calls",14,IMPLEMENTED,VALIDATED,server/automationBatch14.ts,/api/automation-batch-14/function-138
139,"Call Digest Poster","Posts call summary digests to team channels",14,IMPLEMENTED,VALIDATED,server/automationBatch14.ts,/api/automation-batch-14/function-139
140,"Live Error Push","Pushes real-time errors to monitoring systems",14,IMPLEMENTED,VALIDATED,server/automationBatch14.ts,/api/automation-batch-14/function-140
141,"Bot Training Prompt Generator","Auto-generates training prompts from QA pairs",15,IMPLEMENTED,VALIDATED,server/automationBatch15.ts,/api/automation-batch-15/function-141
142,"Cold Start Logger","Logs system cold start events for monitoring",15,IMPLEMENTED,VALIDATED,server/automationBatch15.ts,/api/automation-batch-15/function-142
143,"Markdown Converter","Converts internal notes to markdown format",15,IMPLEMENTED,VALIDATED,server/automationBatch15.ts,/api/automation-batch-15/function-143
144,"QBO Invoice Summary","Parses and summarizes QuickBooks invoices",15,IMPLEMENTED,VALIDATED,server/automationBatch15.ts,/api/automation-batch-15/function-144
145,"Role Assignment by Domain","Auto-assigns contact roles based on email domain",15,IMPLEMENTED,VALIDATED,server/automationBatch15.ts,/api/automation-batch-15/function-145
146,"Customer Reconciliation","Reconciles Airtable and Stripe customer records",15,IMPLEMENTED,VALIDATED,server/automationBatch15.ts,/api/automation-batch-15/function-146
147,"Full API Health Check","Runs system-wide API health checks",15,IMPLEMENTED,VALIDATED,server/automationBatch15.ts,/api/automation-batch-15/function-147
148,"ROI Summary Generator","Generates client ROI record summaries",15,IMPLEMENTED,VALIDATED,server/automationBatch15.ts,/api/automation-batch-15/function-148
149,"Manual Override Logger","Logs manual overrides in Command Center",15,IMPLEMENTED,VALIDATED,server/automationBatch15.ts,/api/automation-batch-15/function-149
150,"Slack Message Formatter","Formats messages with emoji status tags",15,IMPLEMENTED,VALIDATED,server/automationBatch15.ts,/api/automation-batch-15/function-150
151,"VoiceBot Escalation Detection","Detects escalation intent in voice transcripts",16,IMPLEMENTED,VALIDATED,server/automationBatch16.ts,/api/automation-batch-16/function-151
152,"Failure Categorization","Auto-categorizes integration failures by module",16,IMPLEMENTED,VALIDATED,server/automationBatch16.ts,/api/automation-batch-16/function-152
153,"System Health Metric Update","Updates live system health metrics",16,IMPLEMENTED,VALIDATED,server/automationBatch16.ts,/api/automation-batch-16/function-153
154,"Broken Link Detection","Detects broken linked records in Airtable",16,IMPLEMENTED,VALIDATED,server/automationBatch16.ts,/api/automation-batch-16/function-154
155,"AI Script Expansion","Expands short prompts into full call scripts",16,IMPLEMENTED,VALIDATED,server/automationBatch16.ts,/api/automation-batch-16/function-155
156,"Google Drive Backup","Triggers backup exports to Google Drive",16,IMPLEMENTED,VALIDATED,server/automationBatch16.ts,/api/automation-batch-16/function-156
157,"New Lead Notification","Sends Slack notifications for new leads",16,IMPLEMENTED,VALIDATED,server/automationBatch16.ts,/api/automation-batch-16/function-157
158,"Domain Extraction","Extracts clean domains from URLs",16,IMPLEMENTED,VALIDATED,server/automationBatch16.ts,/api/automation-batch-16/function-158
159,"Auto-Complete Task","Auto-marks internal tasks as complete by label",16,IMPLEMENTED,VALIDATED,server/automationBatch16.ts,/api/automation-batch-16/function-159
160,"Test Snapshot Creation","Creates test snapshot records",16,IMPLEMENTED,VALIDATED,server/automationBatch16.ts,/api/automation-batch-16/function-160